{
  "$schema": "https://json-schema.org/draft/2020-12/schema",
  "$id": "easy-edits/style-pack/v1",
  "title": "Easy Edits style pack",
  "description": "One JSON file = one editing style: palette, fonts, caption look, motion, pacing and the scenes it allows. Validated by easy-edits/engine/style-pack.mjs (`easy-edits style validate <pack>`); the renderer refuses a pack that fails this schema and any request (mode, format, plan beat, flag) the pack does not allow.",
  "type": "object",
  "additionalProperties": false,
  "required": ["schemaVersion", "id", "name", "description", "modes", "formats", "palette", "fonts", "captions", "motion", "pacing", "scenes", "sound"],
  "properties": {
    "schemaVersion": { "const": 1, "description": "Pack format version. Only 1 exists." },
    "id": { "type": "string", "pattern": "^[a-z][a-z0-9-]{1,31}$", "x-error": "must be 2-32 lowercase letters, digits or dashes, starting with a letter", "description": "Short id, lowercase letters, digits and dashes: what `--style <id>` takes." },
    "name": { "type": "string", "minLength": 2, "maxLength": 40 },
    "description": { "type": "string", "minLength": 10, "maxLength": 400, "description": "One or two sentences: what the style looks and feels like." },
    "useFor": { "type": "string", "maxLength": 300, "description": "What kind of video this style suits (goes into the generated skill)." },
    "modes": {
      "type": "array", "minItems": 1, "uniqueItems": true,
      "items": { "enum": ["captions", "talking-head", "explainer", "shorts"] },
      "description": "Modes that may render with this pack. clean-cut is not listed: it keeps the approved caption look."
    },
    "formats": { "type": "array", "minItems": 1, "uniqueItems": true, "items": { "enum": ["9x16", "1x1", "16x9"] } },
    "palette": {
      "type": "object", "additionalProperties": false,
      "required": ["background", "surface", "text", "accent", "accent2", "onAccent"],
      "properties": {
        "background": { "$ref": "#/$defs/hex", "description": "Cards, letterbox and seams." },
        "surface": { "$ref": "#/$defs/hex", "description": "Top-box panels (a gradient from surface to background)." },
        "text": { "$ref": "#/$defs/hex", "description": "Text on background / surface." },
        "accent": { "$ref": "#/$defs/hex", "description": "The signature colour: bars, discs, highlights." },
        "accent2": { "$ref": "#/$defs/hex", "description": "Second colour (the left side of a compare, glitch split)." },
        "onAccent": { "$ref": "#/$defs/hex", "description": "Text and icons drawn on an accent fill." }
      }
    },
    "fonts": {
      "type": "object", "additionalProperties": false,
      "required": ["display", "body", "numbers"],
      "properties": {
        "display": { "$ref": "#/$defs/font", "description": "Titles, cards, hook." },
        "body": { "$ref": "#/$defs/font", "description": "Lists, quotes, lower thirds, labels." },
        "numbers": { "$ref": "#/$defs/font", "description": "Stat values." }
      }
    },
    "captions": {
      "type": "object", "additionalProperties": false,
      "required": ["font", "weight", "size", "case", "maxWords", "maxChars", "color", "highlight", "highlightStyle", "animation", "edge", "shadow"],
      "properties": {
        "font": { "enum": ["display", "body", "numbers"], "description": "Which of the pack's fonts the captions use." },
        "weight": { "type": "integer", "minimum": 100, "maximum": 900 },
        "size": { "type": "integer", "minimum": 48, "maximum": 120, "description": "Caption size in px on 9:16 (1080 wide); 1:1 and 16:9 scale it like the house captions." },
        "letterSpacing": { "type": "number", "minimum": -2, "maximum": 8 },
        "case": { "enum": ["upper", "lower", "as-spoken"] },
        "maxWords": { "type": "integer", "minimum": 1, "maximum": 8, "description": "Words per caption group." },
        "maxChars": { "type": "integer", "minimum": 6, "maximum": 40, "description": "Characters per caption group (one or two lines)." },
        "color": { "oneOf": [{ "const": "auto" }, { "$ref": "#/$defs/hex" }], "x-error": "must be \"auto\" or a #RRGGBB colour", "description": "\"auto\" samples the footage behind each caption and picks light or dark text; a #RRGGBB fixes it." },
        "highlight": { "enum": ["none", "keywords", "active-word"], "description": "keywords: numbers and the plan's key words; active-word: the word being spoken." },
        "highlightStyle": { "enum": ["color", "underline", "glow", "box"] },
        "animation": { "enum": ["pop", "fade-up", "type", "none"], "description": "pop: scale overshoot; fade-up: rise and fade in; type: words appear as they are spoken." },
        "edge": { "type": "number", "minimum": 0, "maximum": 8, "description": "Outline width in px (painted under the fill; its colour follows the text colour)." },
        "shadow": { "enum": ["soft", "hard", "glow", "none"] }
      }
    },
    "motion": {
      "type": "object", "additionalProperties": false,
      "required": ["transition", "transitionDuration", "entrance", "numbers", "signature", "drift"],
      "properties": {
        "transition": { "enum": ["cut", "whip", "dip", "glitch"], "description": "What happens at every layout change: hard cut, a whip-pan smear, a dip through the background colour, or an RGB-split glitch." },
        "transitionDuration": { "type": "number", "minimum": 0.06, "maximum": 0.6 },
        "entrance": { "enum": ["drop", "slide", "fade", "flicker"], "description": "How panels, pops and the hook come in." },
        "numbers": { "enum": ["slam", "count-up", "scramble"], "description": "Stat values: slam in big, count up from zero, or decode through random digits." },
        "signature": { "enum": ["punch-shake", "letterbox", "hud"], "description": "The style's signature move on every punch-in: a zoom hit with a short shake, cinematic letterbox bars, or HUD corner brackets around the face." },
        "drift": { "type": "number", "minimum": 0, "maximum": 0.08, "description": "Slow push-in over a face segment (0.035 = 3.5%)." }
      }
    },
    "pacing": {
      "type": "object", "additionalProperties": false,
      "required": ["minBeatGap", "maxBeatsPerMinute", "punchZoom"],
      "properties": {
        "minBeatGap": { "type": "number", "minimum": 1, "maximum": 12, "description": "Seconds between two pops / punch-ins (top boxes are spaced by the planner)." },
        "maxBeatsPerMinute": { "type": "integer", "minimum": 2, "maximum": 40 },
        "punchZoom": { "type": "array", "minItems": 2, "maxItems": 2, "items": { "type": "number", "minimum": 1.05, "maximum": 2 }, "description": "[min, max] punch-in zoom." }
      }
    },
    "scenes": {
      "type": "array", "minItems": 1, "uniqueItems": true,
      "items": { "enum": ["punch", "icon", "stat", "quote", "list", "compare", "card", "lower-third", "hook", "progress", "intro", "outro"] },
      "description": "Every scene the style may show. Anything else is refused (a --plan beat, --hook, --speaker) or left out (planner beats, intro / outro, progress bar)."
    },
    "sound": {
      "type": "object", "additionalProperties": false,
      "required": ["sfx", "music"],
      "properties": {
        "sfx": { "enum": ["full", "soft", "none"] },
        "music": { "type": ["string", "null"], "maxLength": 60, "description": "Default Openverse search for the music bed (talking-head / explainer), null = no music. --music / --no-music override it." }
      }
    }
  },
  "$defs": {
    "hex": { "type": "string", "pattern": "^#[0-9A-Fa-f]{6}$", "x-error": "must be a #RRGGBB colour" },
    "font": {
      "type": "object", "additionalProperties": false,
      "required": ["family", "weight"],
      "properties": {
        "family": { "enum": ["Montserrat", "Playfair Display", "JetBrains Mono"], "description": "Only the fonts ./install.sh installs (SIL OFL)." },
        "weight": { "type": "integer", "minimum": 100, "maximum": 900 }
      }
    }
  }
}
